#!/bin/bash
# Mock for `smartctl` commands called by collect-stats.sh
# 返回模拟的 SMART 健康数据

cat <<'SMART'
=== START OF INFORMATION SECTION ===
Model Family:     QEMU Virtual Disk
Device Model:     Test Disk 001
Serial Number:    MOCK-SERIAL-001
Firmware Version: 2.5+
User Capacity:    1,073,741,824,000 bytes [1.07 TB]
Sector Size:      512 bytes logical/physical
Rotation Rate:    7200 rpm
Form Factor:      3.5 inches
Device is:        Not in smartctl database [for test use only]

=== START OF READ SMART DATA SECTION ===
SMART overall-health self-assessment test result: PASSED

SMART Attributes Data Structure revision number: 10
Vendor Specific SMART Attributes with Thresholds:
ID# ATTRIBUTE_NAME          FLAG     VALUE WORST THRESH TYPE      UPDATED  WHEN_FAILED RAW_VALUE
  1 Raw_Read_Error_Rate     0x000f   100   100   006    Pre-fail  Always       -       0
  5 Reallocated_Sector_Ct   0x0033   100   100   036    Pre-fail  Always       -       0
  9 Power_On_Hours          0x0032   099   099   000    Old_age   Always       -       8750
 12 Power_Cycle_Count       0x0032   100   100   000    Old_age   Always       -       85
194 Temperature_Celsius     0x0022   040   040   000    Old_age   Always       -       40 (Min/Max 25/55)
SMART
